[
  {
    "id": 2803843,
    "gisId": 2772580,
    "regionId": 848340027,
    "municipality": "100 Mile House",
    "area": "West of HWY 97",
    "cause": "Fire",
    "numCustomersOut": 303,
    "crewStatus": "ASSIGNED",
    "crewStatusDescription": "Crew assigned",
    "crewStatusNote": "",
    "crewEta": null,
    "dateOff": 1785032760000,
    "dateOn": null,
    "lastUpdated": 1785163901000,
    "regionName": "Central Interior",
    "crewEtr": null,
    "showEta": false,
    "showEtr": false,
    "showDateOn": false,
    "latitude": 51.293529,
    "longitude": -121.854261,
    "polygon": [
      -121.397126,
      51.298038,
      -121.397144,
      51.298201,
      -121.397209,
      51.29836,
      -121.397319,
      51.298509,
      -121.39747,
      51.298642,
      -121.397657,
      51.298757,
      -121.398686,
      51.299279,
      -121.398872,
      51.299359,
      -121.399076,
      51.29942,
      -121.720913,
      51.376022,
      -121.720929,
      51.376025,
      -122.148432,
      51.472315,
      -122.14865,
      51.472352,
      -122.148875,
      51.472367,
      -122.154887,
      51.472472,
      -122.155129,
      51.472463,
      -122.155366,
      51.47243,
      -122.155674,
      51.472368,
      -122.155876,
      51.472317,
      -122.156063,
      51.472248,
      -122.166644,
      51.467611,
      -122.166834,
      51.467511,
      -122.166994,
      51.467393,
      -122.167119,
      51.467259,
      -122.167205,
      51.467114,
      -122.167251,
      51.466961,
      -122.167253,
      51.466806,
      -122.133176,
      51.183704,
      -122.133128,
      51.183531,
      -122.133028,
      51.183368,
      -122.13288,
      51.18322,
      -122.132688,
      51.183092,
      -122.131745,
      51.182576,
      -122.131528,
      51.182479,
      -122.131286,
      51.182408,
      -122.115545,
      51.17888,
      -122.056241,
      51.165782,
      -122.056068,
      51.165752,
      -122.05589,
      51.165735,
      -121.935347,
      51.159091,
      -121.935155,
      51.159088,
      -121.934964,
      51.159102,
      -121.534521,
      51.204305,
      -121.53445,
      51.204314,
      -121.53438,
      51.204326,
      -121.489239,
      51.212336,
      -121.489163,
      51.212351,
      -121.489089,
      51.212368,
      -121.486014,
      51.213153,
      -121.485821,
      51.213214,
      -121.485644,
      51.213292,
      -121.485488,
      51.213386,
      -121.485356,
      51.213493,
      -121.397362,
      51.297563,
      -121.397236,
      51.297711,
      -121.397157,
      51.297871
    ]
  },
  {
    "id": 2803729,
    "gisId": 2772470,
    "regionId": 848340027,
    "municipality": "100 Mile House",
    "area": "South of 3100 RD, West of MEADOW LAKE RD",
    "cause": "Fire",
    "numCustomersOut": 28,
    "crewStatus": "ASSIGNED",
    "crewStatusDescription": "Crew assigned",
    "crewStatusNote": "",
    "crewEta": null,
    "dateOff": 1785021505000,
    "dateOn": null,
    "lastUpdated": 1785163853000,
    "regionName": "Central Interior",
    "crewEtr": null,
    "showEta": false,
    "showEtr": false,
    "showDateOn": false,
    "latitude": 51.219887,
    "longitude": -121.637104,
    "polygon": [
      -121.577008,
      51.188008,
      -121.577023,
      51.188156,
      -121.577076,
      51.1883,
      -121.577166,
      51.188437,
      -121.577291,
      51.188563,
      -121.655536,
      51.254498,
      -121.655664,
      51.254591,
      -121.65581,
      51.254672,
      -121.655973,
      51.25474,
      -121.677705,
      51.262546,
      -121.687248,
      51.265916,
      -121.687456,
      51.265977,
      -121.687676,
      51.266015,
      -121.687904,
      51.266031,
      -121.688132,
      51.266025,
      -121.68871,
      51.265979,
      -121.688898,
      51.265955,
      -121.68908,
      51.265917,
      -121.689252,
      51.265863,
      -121.698651,
      51.262422,
      -121.69888,
      51.262317,
      -121.699072,
      51.262187,
      -121.69922,
      51.262035,
      -121.699317,
      51.261867,
      -121.69936,
      51.261692,
      -121.699346,
      51.261514,
      -121.699278,
      51.261341,
      -121.699156,
      51.261181,
      -121.629635,
      51.188574,
      -121.629493,
      51.18845,
      -121.62932,
      51.188343,
      -121.62912,
      51.188256,
      -121.61742,
      51.184036,
      -121.61733,
      51.184006,
      -121.617236,
      51.18398,
      -121.615958,
      51.183661,
      -121.615817,
      51.183632,
      -121.615673,
      51.183611,
      -121.581331,
      51.179882,
      -121.581061,
      51.179869,
      -121.580791,
      51.179888,
      -121.580533,
      51.179939,
      -121.580294,
      51.180019,
      -121.580084,
      51.180127,
      -121.579909,
      51.180257,
      -121.579777,
      51.180406,
      -121.579692,
      51.180567,
      -121.577044,
      51.187825,
      -121.577018,
      51.187916
    ]
  }
]